{
  "contract_version": "goodwill-v1",
  "synthetic": true,
  "metric_run_id": "40be5270069845db9baec8495684f9af",
  "filters_applied": {
    "start_date": "2026-09-30",
    "end_date": "2026-09-30",
    "source": "upright_replica",
    "platform": null,
    "store": null,
    "reporting_timezone": "America/New_York"
  },
  "offset": 0,
  "limit": 2,
  "total_rows": 128,
  "rows": [
    {
      "version_id": "33bbdbd11f8247f196a8ee01b6907110",
      "record_key": "[\"UP-20260930-0001\"]",
      "file_id": "543247470f52449fbf285b97fc714858ada89758a7c2fd687a2227d5be2e45e3",
      "batch_id": "4e2bb66e196c4f8c9f6254b5318e6bff",
      "source_row_number": 1,
      "parser_version": "sales-parser-v1",
      "rule_version": "trusted-data-v1",
      "reporting_date": "2026-09-30",
      "source_date": "2026-09-30",
      "source_timestamp": "2026-09-30T18:00:00+00:00",
      "platform": "ShopGoodwill",
      "store_id": "GW-001",
      "buyer_id": "DEMO-UPRIGHT-0001",
      "gross_item_sales": "47.64",
      "refunds": "23.82",
      "demo_net_sales": "23.82",
      "currency": "USD",
      "synthetic": true,
      "original_row": {
        "buyer_id": "DEMO-UPRIGHT-0001",
        "category": "Home",
        "channel": "Shopgoodwill",
        "currency": "USD",
        "grain": "one row per paid order",
        "gross_sales": "47.64",
        "item_id": "DEMO-ITEM-20260930-0001",
        "item_title": "Vintage ceramic vase",
        "marketplace_fee": "4.76",
        "net_sales": "23.82",
        "paid_at": "2026-09-30T18:00:00+00:00",
        "paid_order_id": "UP-20260930-0001",
        "quantity": "1",
        "refund_amount": "23.82",
        "reporting_date": "2026-09-30",
        "reporting_timezone": "America/Indiana/Indianapolis",
        "sales_tax": "3.33",
        "shipping_collected": "3.99",
        "source_name": "upright_replica",
        "store_id": "GW-001",
        "synthetic": "true"
      }
    },
    {
      "version_id": "5b3740bbbb6d4957a652a5685cf1461c",
      "record_key": "[\"UP-20260930-0002\"]",
      "file_id": "543247470f52449fbf285b97fc714858ada89758a7c2fd687a2227d5be2e45e3",
      "batch_id": "4e2bb66e196c4f8c9f6254b5318e6bff",
      "source_row_number": 2,
      "parser_version": "sales-parser-v1",
      "rule_version": "trusted-data-v1",
      "reporting_date": "2026-09-30",
      "source_date": "2026-09-30",
      "source_timestamp": "2026-09-30T19:00:00+00:00",
      "platform": "eBay",
      "store_id": "GW-002",
      "buyer_id": "DEMO-UPRIGHT-0002",
      "gross_item_sales": "49.75",
      "refunds": "0.00",
      "demo_net_sales": "49.75",
      "currency": "USD",
      "synthetic": true,
      "original_row": {
        "buyer_id": "DEMO-UPRIGHT-0002",
        "category": "Apparel",
        "channel": "eBay",
        "currency": "USD",
        "grain": "one row per paid order",
        "gross_sales": "49.75",
        "item_id": "DEMO-ITEM-20260930-0002",
        "item_title": "Wool cardigan, size S",
        "marketplace_fee": "4.97",
        "net_sales": "49.75",
        "paid_at": "2026-09-30T19:00:00+00:00",
        "paid_order_id": "UP-20260930-0002",
        "quantity": "1",
        "refund_amount": "0.00",
        "reporting_date": "2026-09-30",
        "reporting_timezone": "America/Indiana/Indianapolis",
        "sales_tax": "3.48",
        "shipping_collected": "4.99",
        "source_name": "upright_replica",
        "store_id": "GW-002",
        "synthetic": "true"
      }
    }
  ],
  "scope_total": "7127.78"
}
